{
  "$schema": "http://json-schema.org/draft-07/schema#",
  "title": "API",
  "description": "VK API declaration",
  "type": "object",
  "definitions": {
    "enum": {
      "type": "array",
      "minItems": 1,
      "uniqueItems": true
    },
    "format": {
      "type": "string",
      "enum": [
        "json",
        "int32",
        "int64"
      ]
    },
    "enumNames": {
      "type": "array",
      "description": "Enum values text representations",
      "items": {
        "type": "string"
      },
      "minItems": 1,
      "uniqueItems": true
    },
    "jsonReference": {
      "type": "object",
      "required": [
        "$ref"
      ],
      "additionalProperties": false,
      "properties": {
        "$ref": {
          "type": "string"
        }
      }
    },
    "parameterArray": {
      "type": "array",
      "minItems": 1,
      "items": {
        "$ref": "#"
      }
    },
    "parameterTypes": {
      "type": "string",
      "enum": [
        "array",
        "boolean",
        "integer",
        "number",
        "string"
      ]
    },
    "responseTypes": {
      "type": "string",
      "enum": [
        "array",
        "boolean",
        "integer",
        "number",
        "string",
        "object"
      ]
    },
    "responsePropertyTypes": {
      "type": "string",
      "enum": [
        "array",
        "boolean",
        "integer",
        "number",
        "string"
      ]
    },
    "itemTypes": {
      "type": "string",
      "enum": [
        "object",
        "boolean",
        "integer",
        "number",
        "string"
      ]
    },
    "parameter": {
      "type": "object",
      "properties": {
        "name": {
          "type": "string",
          "pattern": "^[a-zA-Z][a-zA-Z0-9_]*$",
          "description": "Parameter name"
        },
        "format": {
          "$ref": "#/definitions/format"
        },
        "type": {
          "$ref": "#/definitions/parameterTypes",
          "description": "Parameter type"
        },
        "items": {
          "type": "object",
          "properties": {
            "$ref": {
              "type": "string",
              "format": "uri-reference"
            },
            "type": {
              "$ref": "#/definitions/itemTypes"
            },
            "format": {
              "$ref": "#/definitions/format"
            },
            "maximum": {
              "type": "number"
            },
            "minimum": {
              "type": "number"
            },
            "minLength": {
              "type": "integer",
              "minimum": 0,
              "default": 0
            },
            "maxLength": {
              "type": "integer",
              "minimum": 0
            },
            "enum": {
              "type": "array",
              "description": "Allowed enumerable values",
              "$ref": "#/definitions/enum"
            },
            "enumNames": {
              "$ref": "#/definitions/enumNames"
            }
          },
          "oneOf": [
            {
              "required": [
                "type"
              ]
            },
            {
              "required": [
                "$ref"
              ]
            }
          ],
          "additionalProperties": false
        },
        "maxItems": {
          "type": "integer",
          "minimum": 0
        },
        "minItems": {
          "type": "integer",
          "minimum": 0,
          "default": 0
        },
        "maximum": {
          "type": "number"
        },
        "minimum": {
          "type": "number"
        },
        "$ref": {
          "type": "string",
          "format": "uri-reference"
        },
        "enum": {
          "type": "array",
          "$ref": "#/definitions/enum"
        },
        "enumNames": {
          "$ref": "#/definitions/enumNames"
        },
        "default": {
          "description": "Default property value"
        },
        "required": {
          "type": "boolean",
          "default": false
        },
        "maxLength": {
          "type": "integer",
          "minimum": 0
        },
        "minLength": {
          "type": "integer",
          "minimum": 0,
          "default": 0
        },
        "description": {
          "type": "string",
          "description": "Parameter description"
        }
      },
      "required": [
        "name",
        "type"
      ],
      "additionalProperties": false
    },
    "responseProperty": {
      "type": "object",
      "oneOf": [
        {
          "required": [
            "type"
          ]
        },
        {
          "required": [
            "$ref"
          ]
        }
      ],
      "properties": {
        "type": {
          "$ref": "#/definitions/responseTypes"
        },
        "description": {
          "type": "string"
        }
      }
    },
    "response": {
      "type": "object",
      "properties": {
        "type": {
          "type": "string"
        },
        "description": {
          "type": "string"
        },
        "allOf": {
          "type": "array",
          "items": {
            "$ref": "#/definitions/response"
          }
        },
        "items": {
          "oneOf": [
            {
              "type": "array"
            },
            {
              "type": "object",
              "properties": {
                "$ref": {
                  "type": "string"
                }
              }
            }
          ]
        },
        "required": {
          "type": "array"
        },
        "title": {
          "type": "string"
        },
        "oneOf": {
          "type": "array"
        },
        "$ref": {
          "type": "string",
          "format": "uri-reference"
        },
        "properties": {
          "type": "object",
          "patternProperties": {
            "^[a-zA-Z0-9_]+$": {
              "$ref": "#/definitions/responseProperty"
            }
          },
          "additionalProperties": false
        },
        "additionalProperties": {
          "type": "boolean"
        }
      },
      "additionalProperties": false
    },
    "error": {
      "type": "object",
      "properties": {
        "code": {
          "type": "integer",
          "description": "Error code",
          "minimum": 0
        },
        "description": {
          "type": "string",
          "description": "Error description"
        },
        "subcodes": {
          "type": "array",
          "items": {
            "$ref": "#/definitions/error_subcode"
          },
          "description": "Array of error subcodes"
        },
        "global": {
          "type": "boolean",
          "default": false
        },
        "disabled": {
          "type": "boolean",
          "default": false
        }
      },
      "required": [
        "code",
        "description"
      ],
      "additionalProperties": false
    },
    "error_subcode": {
      "type": "object",
      "properties": {
        "subcode": {
          "type": "integer"
        },
        "description": {
          "type": "string"
        },
        "$ref": {
          "type": "string",
          "format": "uri-reference"
        }
      },
      "additionalProperties": false
    },
    "methodErrors": {
      "type": "array",
      "items": {
        "type": "object",
        "properties": {
          "$ref": {
            "type": "string",
            "format": "uri-reference"
          }
        },
        "additionalProperties": false
      },
      "description": "Possible custom errors"
    },
    "method": {
      "type": "object",
      "properties": {
        "name": {
          "type": "string",
          "pattern": "^[a-zA-Z][a-zA-Z0-9.]+$",
          "description": "Method name"
        },
        "description": {
          "type": "string",
          "description": "Method description"
        },
        "timeout": {
          "type": "integer",
          "minimum": 1,
          "maximum": 30
        },
        "access_token_type": {
          "type": "array",
          "items": {
            "type": "string",
            "enum": [
              "open",
              "user",
              "group",
              "service"
            ],
            "description": "Access token type"
          },
          "description": "Input parameters for method"
        },
        "parameters": {
          "type": "array",
          "items": {
            "$ref": "#/definitions/parameter"
          },
          "description": "Input parameters for method"
        },
        "responses": {
          "type": "object",
          "patternProperties": {
            "^([a-zA-Z0-9_]+)?[rR]esponse$": {
              "$ref": "#/definitions/response"
            }
          },
          "additionalProperties": true,
          "description": "References to response objects"
        },
        "emptyResponse": {
          "type": "boolean",
          "default": false
        },
        "errors": {
          "$ref": "#/definitions/methodErrors"
        }
      },
      "required": [
        "name",
        "access_token_type",
        "responses"
      ],
      "additionalProperties": false
    }
  },
  "properties": {
    "errors": {
      "type": "object",
      "patternProperties": {
        "^[a-z][a-z0-9_]+$": {
          "$ref": "#/definitions/error"
        }
      },
      "additionalProperties": false,
      "uniqueProperties": true
    },
    "methods": {
      "type": "array",
      "items": {
        "$ref": "#/definitions/method"
      }
    },
    "definitions": {
      "patternProperties": {
        "^([a-zA-Z0-9_]+)?[rR]esponse$": {
          "$ref": "#/definitions/response"
        }
      },
      "uniqueProperties": true
    },
    "$schema": {
      "type": "string",
      "format": "uri-reference"
    },
    "title": {
      "type": "string"
    },
    "description": {
      "type": "string"
    },
    "termsOfService": {
      "type": "string",
      "format": "url"
    },
    "version": {
      "type": "string"
    }
  },
  "additionalProperties": false
}
