{
  "$schema": "../schema.json",
  "version": "5.199",
  "title": "VK API JSON Schema - responses",
  "description": "Contains JSON Schema documents explaining the VK.COM API - responses",
  "termsOfService": "https://dev.vk.com/rules",
  "definitions": {
    "asr_checkStatus_response": {
      "type": "object",
      "properties": {
        "response": {
          "$ref": "../asr/objects.json#/definitions/asr_task",
          "required": true,
          "additionalProperties": false
        }
      },
      "additionalProperties": false
    },
    "asr_process_response": {
      "type": "object",
      "properties": {
        "response": {
          "type": "object",
          "properties": {
            "task_id": {
              "type": "string",
              "required": true,
              "description": "ID of created task in UUID format."
            }
          },
          "required": true,
          "additionalProperties": false
        }
      },
      "additionalProperties": false
    }
  }
}
