{
  "$schema": "../schema.json",
  "version": "5.199",
  "title": "VK API JSON Schema - objects",
  "description": "Contains JSON Schema documents explaining the VK.COM API - objects",
  "termsOfService": "https://dev.vk.com/rules",
  "definitions": {
    "link_target_object": {
      "type": "object",
      "properties": {
        "type": {
          "type": "string",
          "description": "Object type"
        },
        "owner_id": {
          "type": "integer",
          "description": "Owner ID",
          "entity": "owner",
          "format": "int64"
        },
        "item_id": {
          "type": "integer",
          "description": "Item ID"
        }
      },
      "additionalProperties": false
    }
  }
}
