{
  "$schema": "../schema.json",
  "version": "5.199",
  "title": "VK API JSON Schema - responses",
  "description": "Contains JSON Schema documents explaining the VK.COM API - responses",
  "termsOfService": "https://dev.vk.com/rules",
  "definitions": {
    "bugtracker_addCompanyGroupsMembers_response": {
      "type": "object",
      "properties": {
        "response": {
          "type": "object",
          "properties": {
            "errors": {
              "type": "array",
              "items": {
                "$ref": "../bugtracker/objects.json#/definitions/bugtracker_add_company_groups_members_error"
              },
              "required": true
            }
          },
          "required": true
        }
      }
    },
    "bugtracker_addCompanyMembers_response": {
      "type": "object",
      "properties": {
        "response": {
          "type": "object",
          "properties": {
            "errors": {
              "type": "array",
              "items": {
                "type": "string"
              },
              "required": true
            }
          },
          "required": true
        }
      }
    },
    "bugtracker_createComment_response": {
      "type": "object",
      "properties": {
        "response": {
          "type": "object",
          "properties": {
            "comment": {
              "$ref": "../bugtracker/objects.json#/definitions/bugtracker_comment",
              "required": true
            },
            "comment_flood": {
              "type": "boolean"
            },
            "subscribe_state": {
              "$ref": "../bugtracker/objects.json#/definitions/bugtracker_bugreport_subscribe_state"
            }
          },
          "required": true
        }
      }
    },
    "bugtracker_getBugreportById_response": {
      "type": "object",
      "properties": {
        "response": {
          "type": "object",
          "properties": {
            "bugreport": {
              "$ref": "../bugtracker/objects.json#/definitions/bugtracker_bugreport"
            },
            "profiles": {
              "type": "array",
              "items": {
                "$ref": "../users/objects.json#/definitions/users_user_full"
              }
            }
          },
          "required": true
        }
      }
    },
    "bugtracker_getCompanyGroupMembers_response": {
      "type": "object",
      "properties": {
        "response": {
          "type": "object",
          "properties": {
            "user_ids": {
              "type": "array",
              "items": {
                "type": "integer",
                "minimum": 0,
                "entity": "owner",
                "format": "int64"
              },
              "required": true
            },
            "profiles": {
              "type": "array",
              "items": {
                "$ref": "../users/objects.json#/definitions/users_user_full"
              }
            }
          },
          "required": true
        }
      }
    },
    "bugtracker_getCompanyMembers_response": {
      "type": "object",
      "properties": {
        "response": {
          "type": "object",
          "properties": {
            "company_members": {
              "type": "array",
              "items": {
                "$ref": "../bugtracker/objects.json#/definitions/bugtracker_company_member"
              },
              "required": true
            },
            "count": {
              "type": "integer",
              "required": true
            },
            "profiles": {
              "type": "array",
              "items": {
                "$ref": "../users/objects.json#/definitions/users_user_full"
              }
            }
          },
          "required": true
        }
      }
    },
    "bugtracker_getDownloadVersionUrl_response": {
      "type": "object",
      "properties": {
        "response": {
          "type": "object",
          "properties": {
            "url": {
              "type": "string",
              "required": true
            },
            "app_title": {
              "type": "string"
            },
            "bundle_name": {
              "type": "string"
            },
            "build_id": {
              "type": "integer"
            },
            "build_name": {
              "type": "string"
            },
            "build_title": {
              "type": "string"
            }
          },
          "required": true
        }
      }
    }
  }
}
