{
  "$schema": "../schema.json",
  "version": "5.199",
  "title": "VK API JSON Schema - objects",
  "description": "Contains JSON Schema documents explaining the VK.COM API - objects",
  "termsOfService": "https://dev.vk.com/rules",
  "definitions": {
    "prettyCards_button_one_of": {
      "type": "object",
      "oneOf": [
        {
          "type": "object",
          "$ref": "../base/objects.json#/definitions/base_link_button"
        },
        {
          "type": "string"
        }
      ]
    },
    "prettyCards_prettyCard": {
      "type": "object",
      "properties": {
        "inner_type": {
          "type": "string",
          "required": true,
          "enum": [
            "prettyCards_prettyCard"
          ],
          "default": "prettyCards_prettyCard"
        },
        "button": {
          "description": "Button key",
          "$ref": "../prettyCards/objects.json#/definitions/prettyCards_button_one_of"
        },
        "button_text": {
          "type": "string",
          "description": "Button text in current language"
        },
        "card_id": {
          "type": "string",
          "description": "Card ID (long int returned as string)",
          "required": true
        },
        "images": {
          "type": "array",
          "items": {
            "$ref": "../base/objects.json#/definitions/base_image"
          }
        },
        "link_url": {
          "type": "string",
          "description": "Link URL",
          "required": true
        },
        "photo": {
          "type": "string",
          "description": "Photo ID (format \"<owner_id>_<media_id>\")",
          "required": true
        },
        "price": {
          "type": "string",
          "description": "Price if set (decimal number returned as string)"
        },
        "price_old": {
          "type": "string",
          "description": "Old price if set (decimal number returned as string)"
        },
        "title": {
          "type": "string",
          "description": "Title",
          "required": true
        }
      }
    },
    "prettyCards_prettyCardOrError": {
      "type": "object",
      "discriminator": {
        "propertyName": "inner_type",
        "mapping": {
          "prettyCards_prettyCard": "../prettyCards/objects.json#/definitions/prettyCards_prettyCard",
          "base_error": "../base/objects.json#/definitions/base_error"
        }
      },
      "oneOf": [
        {
          "$ref": "../prettyCards/objects.json#/definitions/prettyCards_prettyCard"
        },
        {
          "$ref": "../base/objects.json#/definitions/base_error"
        }
      ]
    }
  }
}
