{
  "$schema": "../schema.json",
  "version": "5.199",
  "title": "VK API JSON Schema - objects",
  "description": "Contains JSON Schema documents explaining the VK.COM API - objects",
  "termsOfService": "https://dev.vk.com/rules",
  "definitions": {
    "oauth_error": {
      "type": "object",
      "properties": {
        "error": {
          "type": "string",
          "description": "Error type",
          "required": true
        },
        "error_description": {
          "type": "string",
          "description": "Error description",
          "required": true
        },
        "redirect_uri": {
          "type": "string",
          "description": "URI for validation"
        }
      },
      "additionalProperties": false
    }
  }
}
