{
  "$schema": "../schema.json",
  "version": "5.199",
  "title": "VK API JSON Schema - responses",
  "description": "Contains JSON Schema documents explaining the VK.COM API - responses",
  "termsOfService": "https://dev.vk.com/rules",
  "definitions": {
    "leadForms_create_response": {
      "type": "object",
      "properties": {
        "response": {
          "type": "object",
          "properties": {
            "form_id": {
              "type": "integer",
              "required": true
            },
            "url": {
              "type": "string",
              "format": "uri",
              "required": true
            }
          },
          "additionalProperties": false,
          "required": true
        }
      },
      "additionalProperties": false
    },
    "leadForms_delete_response": {
      "type": "object",
      "properties": {
        "response": {
          "type": "object",
          "properties": {
            "form_id": {
              "type": "integer",
              "required": true
            }
          },
          "additionalProperties": false,
          "required": true
        }
      },
      "additionalProperties": false
    },
    "leadForms_getLeads_response": {
      "type": "object",
      "properties": {
        "response": {
          "type": "object",
          "properties": {
            "leads": {
              "type": "array",
              "items": {
                "$ref": "../leadForms/objects.json#/definitions/leadForms_lead"
              },
              "required": true
            },
            "next_page_token": {
              "type": "string"
            }
          },
          "additionalProperties": false,
          "required": true
        }
      },
      "additionalProperties": false
    },
    "leadForms_get_response": {
      "type": "object",
      "properties": {
        "response": {
          "$ref": "../leadForms/objects.json#/definitions/leadForms_form",
          "required": true
        }
      },
      "additionalProperties": false
    },
    "leadForms_list_response": {
      "type": "object",
      "properties": {
        "response": {
          "type": "array",
          "items": {
            "$ref": "../leadForms/objects.json#/definitions/leadForms_form"
          },
          "required": true
        }
      },
      "additionalProperties": false
    },
    "leadForms_uploadUrl_response": {
      "type": "object",
      "properties": {
        "response": {
          "type": "string",
          "format": "uri",
          "required": true
        }
      },
      "additionalProperties": false
    }
  }
}
